{
  "id": "editorial-commerce",
  "name": "编辑型时尚",
  "sourceType": "style-reference",
  "sourceStatus": "风格参考",
  "reviewedAt": "2026-08-13",
  "platforms": ["web", "ios"],
  "industry": ["电商", "生活方式", "内容"],
  "styles": ["编辑式", "极简", "奢侈品"],
  "completeness": "完整系统",
  "foundations": {
    "colors": { "paper": "#F7F4EF", "ink": "#2D251F", "accent": "#A45855", "muted": "#9B9188" },
    "typography": { "display": "授权衬线字体或高对比开源替代", "body": "系统无衬线", "scale": "40 / 28 / 18 / 14" },
    "spacing": "4px 基线，24px 内容边距，48px 区块间距",
    "radius": "8px 内容容器，圆形仅用于头像与图像",
    "elevation": "无厚阴影，以留白和细边界分层",
    "grid": "12 列 Web，4 列移动端",
    "motion": "180ms 淡入、收藏和画面切换"
  },
  "components": {
    "button": "深色实心主操作，文字短且明确",
    "card": "图片优先，信息区平整无套卡",
    "navigation": "低干扰文字导航，当前态使用细线",
    "form": "细下划线或浅边框，避免高饱和输入框",
    "dialog": "白底编辑式详情，保留充足阅读边距"
  },
  "visualLanguage": {
    "photography": "自然柔光、单一主体、保留剪裁与文案安全区；不生成品牌 logo 或文字",
    "illustration": "克制、材料感优先，不取代功能 icon",
    "iconography": "16-20px 细线代码图标"
  },
  "contentVoice": "简短、感官具体、避免促销堆叠和夸张折扣语气。",
  "accessibility": "正文至少 4.5:1 对比度；不以颜色作为唯一状态信息。",
  "dos": ["让商品和摄影承担第一视觉", "将价格和行动放在稳定阅读层级"],
  "donts": ["不要生成或仿制第三方品牌标识", "不要把折扣、角标和标签同时堆在主视觉上"]
}
